{
  "slot": "INFLUENCER",
  "kit": "influencer",
  "archetype": "buff-mixup",
  "health": 10000,
  "walk": {
    "f": 66,
    "b": 52
  },
  "dash": {
    "f": {
      "frames": 16,
      "dist": 1400
    },
    "b": {
      "frames": 14,
      "dist": 900
    }
  },
  "jump": {
    "pre": 4,
    "v0": 200,
    "gravity": 9,
    "vxF": 45,
    "vxB": 38,
    "land": 3
  },
  "push": {
    "stand": {
      "x": -300,
      "y": 0,
      "w": 600,
      "h": 1700
    },
    "crouch": {
      "x": -300,
      "y": 0,
      "w": 600,
      "h": 1000
    },
    "air": {
      "x": -300,
      "y": 300,
      "w": 600,
      "h": 1200
    }
  },
  "hurtDefault": {
    "stand": [
      {
        "x1": 0,
        "y1": 250,
        "x2": 0,
        "y2": 1500,
        "r": 250
      }
    ],
    "crouch": [
      {
        "x1": 0,
        "y1": 250,
        "x2": 0,
        "y2": 800,
        "r": 280
      }
    ],
    "air": [
      {
        "x1": 0,
        "y1": 350,
        "x2": 0,
        "y2": 1250,
        "r": 250
      }
    ],
    "down": [
      {
        "x1": -500,
        "y1": 150,
        "x2": 500,
        "y2": 150,
        "r": 150
      }
    ]
  },
  "moves": [
    {
      "id": "5L",
      "nameKey": "fighter.influencer.move.5L",
      "kind": "normal",
      "input": {
        "t": "button",
        "buttons": 16
      },
      "schemes": [
        "classic",
        "simple"
      ],
      "startup": 4,
      "active": 2,
      "recovery": 8,
      "hits": [
        {
          "from": 4,
          "hit": {
            "boxes": [
              {
                "x1": 350,
                "y1": 1150,
                "x2": 850,
                "y2": 1150,
                "r": 180
              }
            ],
            "group": 0,
            "damage": 300,
            "chipPermille": 0,
            "hitstun": 13,
            "blockstun": 10,
            "hitstop": 8,
            "pushHit": 150,
            "pushBlock": 200,
            "guard": "mid",
            "juggle": {
              "cost": 99,
              "limit": 0
            },
            "hype": {
              "hit": 40,
              "block": 20,
              "whiff": 0
            },
            "fx": {
              "spark": "light",
              "cue": "hit.light"
            }
          }
        }
      ],
      "tracks": [],
      "invuln": [],
      "cancels": [
        {
          "into": "chain",
          "on": [
            "hit",
            "block"
          ],
          "from": 4,
          "to": 12
        },
        {
          "into": "special",
          "on": [
            "hit",
            "block"
          ],
          "from": 4,
          "to": 12
        },
        {
          "into": "super",
          "on": [
            "hit",
            "block"
          ],
          "from": 4,
          "to": 12
        }
      ],
      "tags": []
    },
    {
      "id": "5M",
      "nameKey": "fighter.influencer.move.5M",
      "kind": "normal",
      "input": {
        "t": "button",
        "buttons": 32
      },
      "schemes": [
        "classic"
      ],
      "startup": 6,
      "active": 3,
      "recovery": 12,
      "hits": [
        {
          "from": 6,
          "hit": {
            "boxes": [
              {
                "x1": 400,
                "y1": 1100,
                "x2": 950,
                "y2": 1100,
                "r": 200
              }
            ],
            "group": 0,
            "damage": 600,
            "chipPermille": 0,
            "hitstun": 19,
            "blockstun": 13,
            "hitstop": 10,
            "pushHit": 200,
            "pushBlock": 250,
            "guard": "mid",
            "juggle": {
              "cost": 99,
              "limit": 0
            },
            "hype": {
              "hit": 60,
              "block": 30,
              "whiff": 0
            },
            "fx": {
              "spark": "medium",
              "cue": "hit.medium"
            }
          }
        }
      ],
      "tracks": [],
      "invuln": [],
      "cancels": [
        {
          "into": "chain",
          "on": [
            "hit",
            "block"
          ],
          "from": 6,
          "to": 17
        },
        {
          "into": "special",
          "on": [
            "hit",
            "block"
          ],
          "from": 6,
          "to": 17
        },
        {
          "into": "super",
          "on": [
            "hit",
            "block"
          ],
          "from": 6,
          "to": 17
        }
      ],
      "tags": []
    },
    {
      "id": "5H",
      "nameKey": "fighter.influencer.move.5H",
      "kind": "normal",
      "input": {
        "t": "button",
        "buttons": 64
      },
      "schemes": [
        "classic",
        "simple"
      ],
      "startup": 10,
      "active": 4,
      "recovery": 17,
      "hits": [
        {
          "from": 10,
          "hit": {
            "boxes": [
              {
                "x1": 450,
                "y1": 1050,
                "x2": 1100,
                "y2": 1150,
                "r": 230
              }
            ],
            "group": 0,
            "damage": 900,
            "chipPermille": 0,
            "hitstun": 23,
            "blockstun": 16,
            "hitstop": 12,
            "pushHit": 300,
            "pushBlock": 400,
            "guard": "mid",
            "juggle": {
              "cost": 99,
              "limit": 0
            },
            "hype": {
              "hit": 80,
              "block": 40,
              "whiff": 0
            },
            "fx": {
              "spark": "heavy",
              "cue": "hit.heavy"
            }
          }
        }
      ],
      "tracks": [],
      "invuln": [],
      "cancels": [
        {
          "into": "special",
          "on": [
            "hit",
            "block"
          ],
          "from": 10,
          "to": 26
        },
        {
          "into": "super",
          "on": [
            "hit",
            "block"
          ],
          "from": 10,
          "to": 26
        }
      ],
      "tags": []
    },
    {
      "id": "2L",
      "nameKey": "fighter.influencer.move.2L",
      "kind": "normal",
      "input": {
        "t": "button",
        "buttons": 16,
        "dir": 2
      },
      "schemes": [
        "classic",
        "simple"
      ],
      "startup": 4,
      "active": 2,
      "recovery": 7,
      "hits": [
        {
          "from": 4,
          "hit": {
            "boxes": [
              {
                "x1": 350,
                "y1": 220,
                "x2": 850,
                "y2": 220,
                "r": 150
              }
            ],
            "group": 0,
            "damage": 250,
            "chipPermille": 0,
            "hitstun": 12,
            "blockstun": 10,
            "hitstop": 8,
            "pushHit": 120,
            "pushBlock": 180,
            "guard": "low",
            "juggle": {
              "cost": 99,
              "limit": 0
            },
            "hype": {
              "hit": 40,
              "block": 20,
              "whiff": 0
            },
            "fx": {
              "spark": "light",
              "cue": "hit.light"
            }
          }
        }
      ],
      "tracks": [],
      "invuln": [],
      "cancels": [
        {
          "into": "chain",
          "on": [
            "hit",
            "block"
          ],
          "from": 4,
          "to": 11
        },
        {
          "into": "special",
          "on": [
            "hit",
            "block"
          ],
          "from": 4,
          "to": 11
        },
        {
          "into": "super",
          "on": [
            "hit",
            "block"
          ],
          "from": 4,
          "to": 11
        }
      ],
      "tags": []
    },
    {
      "id": "2M",
      "nameKey": "fighter.influencer.move.2M",
      "kind": "normal",
      "input": {
        "t": "button",
        "buttons": 32,
        "dir": 2
      },
      "schemes": [
        "classic"
      ],
      "startup": 7,
      "active": 3,
      "recovery": 13,
      "hits": [
        {
          "from": 7,
          "hit": {
            "boxes": [
              {
                "x1": 400,
                "y1": 200,
                "x2": 1000,
                "y2": 200,
                "r": 170
              }
            ],
            "group": 0,
            "damage": 550,
            "chipPermille": 0,
            "hitstun": 19,
            "blockstun": 13,
            "hitstop": 10,
            "pushHit": 180,
            "pushBlock": 230,
            "guard": "low",
            "juggle": {
              "cost": 99,
              "limit": 0
            },
            "hype": {
              "hit": 60,
              "block": 30,
              "whiff": 0
            },
            "fx": {
              "spark": "medium",
              "cue": "hit.medium"
            }
          }
        }
      ],
      "tracks": [],
      "invuln": [],
      "cancels": [
        {
          "into": "special",
          "on": [
            "hit",
            "block"
          ],
          "from": 7,
          "to": 19
        },
        {
          "into": "super",
          "on": [
            "hit",
            "block"
          ],
          "from": 7,
          "to": 19
        }
      ],
      "tags": []
    },
    {
      "id": "2H",
      "nameKey": "fighter.influencer.move.2H",
      "kind": "normal",
      "input": {
        "t": "button",
        "buttons": 64,
        "dir": 2
      },
      "schemes": [
        "classic",
        "simple"
      ],
      "startup": 11,
      "active": 4,
      "recovery": 22,
      "hits": [
        {
          "from": 11,
          "hit": {
            "boxes": [
              {
                "x1": 450,
                "y1": 180,
                "x2": 1150,
                "y2": 180,